{
  "$schema": "../schemas/codex-authentication-prerequisite.schema.json",
  "schema_id": "mdplace.codex-authentication-prerequisite/v1",
  "prerequisite_id": "codex-authentication:v1",
  "profile_id": "codex-adapter",
  "status": "current",
  "mechanism": "documented_saved_codex_login",
  "opaque": true,
  "satisfied": true,
  "secret_observed": false,
  "claims_established": [],
  "observed_at": "2026-08-23T00:00:00.000Z",
  "expires_at": "2026-09-23T00:00:00.000Z"
}
